{
  "schemaVersion": "fluxball-fixture-bank-v1",
  "fixtureBankId": "fluxball-aer-two-qubit-v1",
  "defaultFixtureId": "fluxball-preparation-v1",
  "compiledAt": "2026-08-18T19:02:53+00:00",
  "deliveryMode": "committed-fixture",
  "acquisitionSource": "finite-shot-aer",
  "derivationMethod": "lstsq-psd",
  "model": {
    "modelId": "fluxball-two-qubit-rulefield-v1",
    "numQubits": 2,
    "qubitMap": [
      {
        "qubit": 0,
        "playerId": "A",
        "displayName": "Player A"
      },
      {
        "qubit": 1,
        "playerId": "B",
        "displayName": "Player B"
      }
    ],
    "configuredEdges": [[0, 1]],
    "topologyKind": "single-two-qubit-rule-relation",
    "initialCircuit": {
      "format": "OPENQASM 2",
      "sha256": "4990bb470ab4995d2d144f399212984b2c01bef2d42b6289ef0a75fd3cdfe4cc",
      "depth": 4,
      "twoQubitDepth": 1,
      "operationCounts": {
        "cx": 1,
        "ry": 3,
        "rz": 2
      },
      "serialization": "OPENQASM 2.0;\ninclude \"qelib1.inc\";\nqreg q[2];\nry(-pi/2) q[0];\ncx q[0],q[1];\nrz(pi/3) q[0];\nry(11*pi/12) q[0];\nrz(pi/12) q[1];\nry(-7*pi/12) q[1];"
    }
  },
  "provenance": {
    "python": "3.9.6",
    "platform": "macOS-26.5.2-arm64-arm-64bit",
    "packageVersions": {
      "quantumgraph": "0.0.1",
      "pairwise-tomography": "0.1.0",
      "qiskit": "2.2.3",
      "qiskit-aer": "0.17.2",
      "numpy": "2.0.2",
      "scipy": "1.13.1"
    },
    "quantumGraphCommit": "6917364b9496bd324225e87e6dd986bce52ecefd",
    "pairwiseTomographyCommit": "dbab12513281bd8ca7828252cf2e98a1a5749761",
    "verifiedSources": {
      "quantumgraph": {
        "url": "https://github.com/moth-quantum/QuantumGraph.git",
        "vcs": "git",
        "commit": "6917364b9496bd324225e87e6dd986bce52ecefd",
        "requestedRevision": "6917364b9496bd324225e87e6dd986bce52ecefd",
        "directUrlSha256": "ab9452661e66536c150ee2ec10c16a1934f0622d2b1434a77ff4b021bc4b428f"
      },
      "pairwise-tomography": {
        "url": "https://github.com/moth-quantum/pairwise-tomography.git",
        "vcs": "git",
        "commit": "dbab12513281bd8ca7828252cf2e98a1a5749761",
        "requestedRevision": "dbab12513281bd8ca7828252cf2e98a1a5749761",
        "directUrlSha256": "ae42a6633e7cdb1a326d4d332b542cfec2653f3087f3210c3c64e6d33d0553ae"
      }
    },
    "sourceRelationship": "Installed distributions record the pinned public Git revisions in direct_url.json; installed file contents were not independently hashed.",
    "qpu": false,
    "remoteService": false,
    "mothApi": false
  },
  "costEstimate": {
    "fixtureCount": 1,
    "tomographyCircuitsPerFixture": 9,
    "totalCircuitExecutions": 9,
    "shotsPerCircuit": 4096,
    "totalShots": 36864
  },
  "fixtures": {
    "fluxball-preparation-v1": {
      "fixtureId": "fluxball-preparation-v1",
      "circuit": {
        "format": "OPENQASM 2",
        "sha256": "4990bb470ab4995d2d144f399212984b2c01bef2d42b6289ef0a75fd3cdfe4cc",
        "depth": 4,
        "twoQubitDepth": 1,
        "operationCounts": {
          "cx": 1,
          "ry": 3,
          "rz": 2
        },
        "serialization": "OPENQASM 2.0;\ninclude \"qelib1.inc\";\nqreg q[2];\nry(-pi/2) q[0];\ncx q[0],q[1];\nrz(pi/3) q[0];\nry(11*pi/12) q[0];\nrz(pi/12) q[1];\nry(-7*pi/12) q[1];"
      },
      "acquisition": {
        "backendClass": "AerSimulator",
        "backendName": "aer_simulator",
        "providerMode": "local-aer",
        "providerName": "qiskit-aer",
        "mothApi": false,
        "jobId": "081bf246-df9c-45c8-99bf-39d7a1335df3",
        "shotsPerCircuit": 4096,
        "simulatorSeed": 260818,
        "transpilerSeed": 260818,
        "tomographyCircuitCount": 9,
        "tomographyMeasurementSettings": [
          "XX",
          "XY",
          "XZ",
          "YX",
          "YY",
          "YZ",
          "ZX",
          "ZY",
          "ZZ"
        ],
        "totalShots": 36864,
        "logicalMeasurementCircuitQasm": [
          "OPENQASM 2.0;\ninclude \"qelib1.inc\";\nqreg q[2];\ncreg c0[2];\nry(-pi/2) q[0];\ncx q[0],q[1];\nrz(pi/3) q[0];\nry(11*pi/12) q[0];\nrz(pi/12) q[1];\nry(-7*pi/12) q[1];\nh q[0];\nmeasure q[0] -> c0[0];\nh q[1];\nmeasure q[1] -> c0[1];",
          "OPENQASM 2.0;\ninclude \"qelib1.inc\";\nqreg q[2];\ncreg c0[2];\nry(-pi/2) q[0];\ncx q[0],q[1];\nrz(pi/3) q[0];\nry(11*pi/12) q[0];\nrz(pi/12) q[1];\nry(-7*pi/12) q[1];\nh q[0];\nmeasure q[0] -> c0[0];\nsdg q[1];\nh q[1];\nmeasure q[1] -> c0[1];",
          "OPENQASM 2.0;\ninclude \"qelib1.inc\";\nqreg q[2];\ncreg c0[2];\nry(-pi/2) q[0];\ncx q[0],q[1];\nrz(pi/3) q[0];\nry(11*pi/12) q[0];\nrz(pi/12) q[1];\nry(-7*pi/12) q[1];\nh q[0];\nmeasure q[0] -> c0[0];\nmeasure q[1] -> c0[1];",
          "OPENQASM 2.0;\ninclude \"qelib1.inc\";\nqreg q[2];\ncreg c0[2];\nry(-pi/2) q[0];\ncx q[0],q[1];\nrz(pi/3) q[0];\nry(11*pi/12) q[0];\nrz(pi/12) q[1];\nry(-7*pi/12) q[1];\nsdg q[0];\nh q[0];\nmeasure q[0] -> c0[0];\nh q[1];\nmeasure q[1] -> c0[1];",
          "OPENQASM 2.0;\ninclude \"qelib1.inc\";\nqreg q[2];\ncreg c0[2];\nry(-pi/2) q[0];\ncx q[0],q[1];\nrz(pi/3) q[0];\nry(11*pi/12) q[0];\nrz(pi/12) q[1];\nry(-7*pi/12) q[1];\nsdg q[0];\nh q[0];\nmeasure q[0] -> c0[0];\nsdg q[1];\nh q[1];\nmeasure q[1] -> c0[1];",
          "OPENQASM 2.0;\ninclude \"qelib1.inc\";\nqreg q[2];\ncreg c0[2];\nry(-pi/2) q[0];\ncx q[0],q[1];\nrz(pi/3) q[0];\nry(11*pi/12) q[0];\nrz(pi/12) q[1];\nry(-7*pi/12) q[1];\nsdg q[0];\nh q[0];\nmeasure q[0] -> c0[0];\nmeasure q[1] -> c0[1];",
          "OPENQASM 2.0;\ninclude \"qelib1.inc\";\nqreg q[2];\ncreg c0[2];\nry(-pi/2) q[0];\ncx q[0],q[1];\nrz(pi/3) q[0];\nry(11*pi/12) q[0];\nrz(pi/12) q[1];\nry(-7*pi/12) q[1];\nmeasure q[0] -> c0[0];\nh q[1];\nmeasure q[1] -> c0[1];",
          "OPENQASM 2.0;\ninclude \"qelib1.inc\";\nqreg q[2];\ncreg c0[2];\nry(-pi/2) q[0];\ncx q[0],q[1];\nrz(pi/3) q[0];\nry(11*pi/12) q[0];\nrz(pi/12) q[1];\nry(-7*pi/12) q[1];\nmeasure q[0] -> c0[0];\nsdg q[1];\nh q[1];\nmeasure q[1] -> c0[1];",
          "OPENQASM 2.0;\ninclude \"qelib1.inc\";\nqreg q[2];\ncreg c0[2];\nry(-pi/2) q[0];\ncx q[0],q[1];\nrz(pi/3) q[0];\nry(11*pi/12) q[0];\nrz(pi/12) q[1];\nry(-7*pi/12) q[1];\nmeasure q[0] -> c0[0];\nmeasure q[1] -> c0[1];"
        ],
        "logicalMeasurementCircuitSha256": [
          "88ad76253c482650de360b337bc300cd37f95352aded022baab96e4a9626dc7e",
          "47f4d16d9ec41d119580a5ac84c65b8e3afdf7ea4d98c3e7d7c4bc380f3c9008",
          "277b3986a8705140e513754fd1bcff3d64909769b957268d444b6df0b30ed0a6",
          "db880f124532e13e64fabacf2faa7689a512eeb786a7a741b5fc8114187f0ffd",
          "9402a1cc94d293e97e92d2bcd20b87d7731ca00de9190f3b72caaa416a1a5721",
          "126523bebf72409b72ba446ec2f50202e110937980d5ecaf9eade78f09648dca",
          "2bb109696d7d6948594e9a6be7c691ce19403058cf079bee82293f2c46787983",
          "626981abacff8ef6cc4ea9ffc2dacabe3baa9963863d9f5d45bbab862a466991",
          "d5bfda4c67b946fc29deb87830984ea0163d1146819c7a862e273f5193d441f6"
        ],
        "transpiledAerCircuitQasm": [
          "OPENQASM 2.0;\ninclude \"qelib1.inc\";\nqreg q[2];\ncreg c0[2];\nry(-pi/2) q[0];\ncx q[0],q[1];\nu3(5*pi/12,-pi,pi/3) q[0];\nu3(11*pi/12,-pi,pi/12) q[1];\nmeasure q[0] -> c0[0];\nmeasure q[1] -> c0[1];",
          "OPENQASM 2.0;\ninclude \"qelib1.inc\";\nqreg q[2];\ncreg c0[2];\nry(-pi/2) q[0];\ncx q[0],q[1];\nu3(5*pi/12,-pi,pi/3) q[0];\nu2(-7*pi/12,7*pi/12) q[1];\nmeasure q[0] -> c0[0];\nmeasure q[1] -> c0[1];",
          "OPENQASM 2.0;\ninclude \"qelib1.inc\";\nqreg q[2];\ncreg c0[2];\nry(-pi/2) q[0];\ncx q[0],q[1];\nu3(5*pi/12,-pi,pi/3) q[0];\nu3(7*pi/12,-pi,-11*pi/12) q[1];\nmeasure q[0] -> c0[0];\nmeasure q[1] -> c0[1];",
          "OPENQASM 2.0;\ninclude \"qelib1.inc\";\nqreg q[2];\ncreg c0[2];\nry(-pi/2) q[0];\ncx q[0],q[1];\nu2(11*pi/12,5*pi/6) q[0];\nu3(11*pi/12,-pi,pi/12) q[1];\nmeasure q[0] -> c0[0];\nmeasure q[1] -> c0[1];",
          "OPENQASM 2.0;\ninclude \"qelib1.inc\";\nqreg q[2];\ncreg c0[2];\nry(-pi/2) q[0];\ncx q[0],q[1];\nu2(11*pi/12,5*pi/6) q[0];\nu2(-7*pi/12,7*pi/12) q[1];\nmeasure q[0] -> c0[0];\nmeasure q[1] -> c0[1];",
          "OPENQASM 2.0;\ninclude \"qelib1.inc\";\nqreg q[2];\ncreg c0[2];\nry(-pi/2) q[0];\ncx q[0],q[1];\nu2(11*pi/12,5*pi/6) q[0];\nu3(7*pi/12,-pi,-11*pi/12) q[1];\nmeasure q[0] -> c0[0];\nmeasure q[1] -> c0[1];",
          "OPENQASM 2.0;\ninclude \"qelib1.inc\";\nqreg q[2];\ncreg c0[2];\nry(-pi/2) q[0];\ncx q[0],q[1];\nu3(11*pi/12,0,pi/3) q[0];\nu3(11*pi/12,-pi,pi/12) q[1];\nmeasure q[0] -> c0[0];\nmeasure q[1] -> c0[1];",
          "OPENQASM 2.0;\ninclude \"qelib1.inc\";\nqreg q[2];\ncreg c0[2];\nry(-pi/2) q[0];\ncx q[0],q[1];\nu3(11*pi/12,0,pi/3) q[0];\nu2(-7*pi/12,7*pi/12) q[1];\nmeasure q[0] -> c0[0];\nmeasure q[1] -> c0[1];",
          "OPENQASM 2.0;\ninclude \"qelib1.inc\";\nqreg q[2];\ncreg c0[2];\nry(-pi/2) q[0];\ncx q[0],q[1];\nu3(11*pi/12,0,pi/3) q[0];\nu3(7*pi/12,-pi,-11*pi/12) q[1];\nmeasure q[0] -> c0[0];\nmeasure q[1] -> c0[1];"
        ],
        "transpiledAerCircuitSha256": [
          "cd5da79602ee532e32d5e529aefa200ad4f9d1b6c831e308d56b5506b4c8d1a2",
          "110e8dd0587e65944c310b99fc0bb23e1c253cc75ef7e545f168d9f09c2a5997",
          "985a0cff3cdf60d94a588b912545d43cb185d7fee7e8f33d157d786907e0cfa5",
          "2322fbf78da51a55b1c7ddd419d0c4c2243f99b5e04f40651b47981f7ec6dd10",
          "4cbbd41bb7d98edcb4512d3084610c53c3a5eb23bba29677b3f4c7573948277a",
          "403d6ed9fa22855ea30a0f2b8de5cee01059179e4ca323821fe87689b2a48488",
          "e27749c43ce2751a019466e5cf89895a718ee94a6673398e1966abd20cc1e722",
          "169ec4a04c950b65b13f16f8ed1f436911251818fa227ae22473a6366949d16e",
          "e45b41fe38c7eae53b6f31c1667a96814444d40ef4a4412f5e9b25ef9f750625"
        ],
        "rawCountsSha256": "ee37d71dd972e3e4d771fd966cb112aba4ea97f9ac6497ed15585e167f5059b6",
        "durableProviderResult": false,
        "hardwareLayout": null,
        "backendCalibration": null,
        "fallbackFrom": null
      },
      "derivation": {